대분류,중분류,제목,작성시간,썸네일 이미지,썸네일 캡션,본문,기사주소,관련기사 제목1,관련기사 주소1,관련기사 이미지1,관련기사 제목2,관련기사 주소2,관련기사 이미지2,관련기사 제목3,관련기사 주소3,관련기사 이미지3,관련기사 제목4,관련기사 주소4,관련기사 이미지4,관련기사 제목5,관련기사 주소5,관련기사 이미지5
경제,기업PR,"서울과기대 인권옹호자 모임 ‘스타라이트', 인권 유관기관 탐방 진행",2024-01-08 08:27,https://flexible.img.hani.co.kr/flexible/normal/640/480/imgdb/original/2024/0108/331704669988781.jpg,"&nbsp; &nbsp; &nbsp; &nbsp; &nbsp; &nbsp; &nbsp; &nbsp; &nbsp; &nbsp; &nbsp; &nbsp; &nbsp; &nbsp; &nbsp; &nbsp; &nbsp;서울과기대 인권센터, 유관기관 탐방 진행.서울과기대 제공","[%%IMAGE1%%]<br><p class=""text"">□ 서울과학기술대학교(총장 김동환, 이하 서울과기대) 인권옹호자 모임인 ‘스타라이트(STARIGHT)’가 2023년 12월 21~22일, 1박 2일간 역량 있는 교내 인권옹호자 양성을 위해 제주도를 방문해 인권 유관기관 탐방을 진행했다.<br>□ 서울과기대 인권센터는 교육부가 주관하는 ‘대학 인권센터 확산 지원 사업’에 선정되었으며, 이에 핵심 사업으로 캠퍼스 내 인권옹호자 양성 프로그램을 진행하고 있다.&nbsp;<br>□ 지난해 9월 공고·선발해 10월부터 활동을 시작한 인권옹호자 학생 9인은 정기 회의와 토론을 통해 학내 인권 문제에 대해 새로운 시각으로 접근해 해결 방안을 모색하고 있다.&nbsp;<br>□ 또한, 카드뉴스를 제작하고 SNS에 정기적으로 업로드하여 확산을 도모하는 등 여러 방식으로 학내 구성원들의 인권감수성 향상을 위한 활발한 활동을 펼치고 있다.&nbsp;<br>□ 매주 수요일 업로드되는 서울과기대 인권옹호자 스타라이트의 카드뉴스는 서울과기대 인권센터 인스타그램(https://instagram.com/seoultech_rights)과 2023스타라이트 블로그(https://blog.naver.com/2023staright)에서 만나볼 수 있다.<br>□ 이번 인권 유관 기관 탐방에서는 반인권적 역사인 4·3사건의 현장 제주도를 찾아가 ▲주정공장수용소 4·3 역사관 방문(12월 21일) ▲ 제주다크투어 특강(12월 22일) 등을 통해, 4·3사건을 희생자의 입장에서 재구성해보는 시간을 가졌다.<br>□ 주정공장수용소 4·3 역사관은 제주 4·3 75주년을 맞아 당시 민간인들이 구금됐던 제주 주정공장 터에 지어진 새로운 역사 박물관이다.&nbsp;<br>&nbsp; ◦ 외부 위령조형물·도시공원, 1층 추모의 방, 지하 전시실과 시청각실로 구성되어 있으며, 희생자와 유족의 입장에서 4· 3사건을 재조명한다는 점이 이 역사관의 특징이다.&nbsp;<br>&nbsp; ◦ 복도에는 최초로 제주4·3을 다룬 그림책 「나무 도장(2016)」의 저자 권윤덕 작가의 원화 전시가 진행 중이며, 주정공장수용소 4·3 역사관 최초 기획 전시인 ‘기리는 마음, 바라는 마음’을 1월 15일까지 만나볼 수 있다.<br>□ 제주다크투어는 제주의 역사를 기억하고 알려 나가는 비영리 단체로 한국, 아시아 과거사 국가폭력 피해자들과 연대하고 있다.&nbsp;<br>&nbsp; ◦ 이곳에서 스타라이트 학생들은 4·3사건 유족인 양성주 대표의 특강을 통해, 4·3사건을 새로운 시각으로 바라보는 뜻깊은 시간을 가졌다.<br>□ 이번 탐방에 참여한 서울과기대 학생 인권옹호자 및 교직원 인권옹호자 10여 명은, “사건의 현장을 눈으로 보고 직접 발로 다녀보면서 활자로만 접했던 지식이 불과 몇십 년 전에 실제 있었던 일이고, 지금도 다른 형태로 계속 인권이 보호받지 못하는 사항들이 도처에 있음을 새삼 깨달았다.”, “4·3사건 관련 소외받은 사람들의 인권을 지키는 방법 중 하나는 관심이며, 관심이 곧 변화로 이어질 수 있음을 깨달았다.” 등의 소감을 밝혔다.&nbsp;</p><p class=""text"">* 자료제공 : 서울과학기술대학교</p><p class=""text"">&lt;이 기사는 대학이 제공한 정보기사로, 한겨레의 의견과 다를 수 있습니다&gt;</p>",https://www.hani.co.kr/arti/economy/biznews/1123364.html,,,,,,,,,,,,,,,
경제,경제일반,총선 일정 고려 않고 감세 전면에…‘내수살리기’ 입법 하반기도 불투명,2024-01-08 07:00,https://flexible.img.hani.co.kr/flexible/normal/970/673/imgdb/original/2024/0107/20240107502049.jpg,2023년의 마지막 날인 12월31일 오후 시민들이 서울 중구 명동 거리에서 이동하고 있다. 연합뉴스,"[%%IMAGE1%%]<br><p class=""text"">정부가 올해 경제정책방향을 발표하며 내수 살리기 대책을 대거 담았지만, 대부분 국회 입법 과정을 거쳐야 하는 까닭에 실제 집행 불확실성이 크다는 평가가 나온다. 오는 4월 총선을 앞두고 정부 방안 다수에 대해 야당이 반대 입장이어서다. 특히 대책 일부는 올해 한시 적용되는 것들이어서 입법이 늦어질수록 효과도 반감된다.</p><p class=""text"">지난 4일 기획재정부가 발표한 ‘2024년 경제정책방향’(이하 경방)은 내수 살리기에 집중됐다. 수출이 되살아나며 경제가 회복세로 돌아섰지만, 내수 시장은 부진하다는 정부 및 국내외 기관의 전망이 이어졌기 때문이다. 내수 살리기 대책은 ‘세금 감면’에 집중됐다. 기업이 투자를 늘리고, 가계가 돈을 더 쓰면 세금을 깎아주겠다는 것이다.</p><p class=""text"">이는 걷어야 할 세금을 걷지 않은 ‘조세 지출’ 방식으로, 국회 입법과정을 거쳐야 한다. 기재부가 직접 꼽은 경방의 주요 입법과제 12개 가운데 8개가 이런 내용의 조세·지방세특례제한법 개정을 전제한다. 개발사업에 부과하는 부담금을 감면해주는 개정 법안도 2건(개발이익환수법·학교용지부담금법)이 기재부의 주요 입법과제에 포함됐다.</p><p class=""text"">올해는 총선이 예정된 데다, 정부·여당이 야당을 설득한 뾰족한 수가 안 보이는 탓에 제때 법안이 통과될지 미지수다. 정부는 오는 2월 첫 임시국회에서 입법과제를 통과시킨다는 게 목표이나. 정작 야당은 ‘감세 정책’에 반대한다. 4월 총선을 앞두고 국회가 열리지 않을 가능성도 거론된다.</p><p class=""text"">총선 이후에도 국회 원 구성에만 평균 41.7일(소선거구제 도입 1988년 13대 국회 이후)이 걸려 현실적으로 6월 이후에나 국회가 가동될 수 있다는 분석도 있다. 이에 경방 대책은 정부가 7월께 발표하는 세법개정안과 함께 심사가 이뤄질 가능성에 무게가 실린다. 통상 세법개정안은 12월이 돼서야 본회의를 통과한다. 특히 경방 주요 입법과제 대다수가 올해 한시 적용되는 것이어서 불확실성이 커질수록 정책 효과는 준다.</p><p class=""text"">최상목 부총리 겸 기획재정부 장관은 4일 브리핑에서 “대부분의 내용이 민생을 위한 것이기 때문에 여야 관계없이 다 협조해주실 걸로 기대하고 있다”고 말했지만, 홍익표 더불어민주당 원내대표는 5일 “계속된 감세정책 기조로 나라의 곳간은 텅텅 비어감에도 재정의 가능성을 확보하려는 노력은 어디에도 찾아볼 수 없다”고 비판했다.</p><p class=""text"">안태호 기자 <a href=""mailto:eco@hani.co.kr"">eco@hani.co.kr</a></p>",https://www.hani.co.kr/arti/economy/economy_general/1123359.html,임기 3년차 정부의 ‘맹탕’ ‘급조’ 경제정책방향,https://www.hani.co.kr/arti/economy/economy_general/1123357.html,https://flexible.img.hani.co.kr/flexible/normal/212/127/imgdb/child/2024/0108/53_17046692069738_20240107502037.jpg,[1월5일 뉴스뷰리핑] 정부 경제정책방향 발표…비판과 정보제공 중 언론의 선택은?,https://www.hani.co.kr/arti/society/society_general/1123109.html,https://flexible.img.hani.co.kr/flexible/normal/212/127/imgdb/original/2024/0105/6217044145145419.jpg,,,,,,,,,
경제,경제일반,임기 3년차 정부의 ‘맹탕’ ‘급조’ 경제정책방향,2024-01-08 07:00,https://flexible.img.hani.co.kr/flexible/normal/800/476/imgdb/original/2024/0107/20240107502037.jpg,윤석열 대통령이 지난 4일 경기도 용인시 중소기업인력개발원에서 ‘국민과 함께하는 민생토론회’ 형식으로 열린 기획재정부의 2024년 신년 업무보고에서 모두발언을 하고 있다. 연합뉴스,"[%%IMAGE1%%]<br>[%%IMAGE2%%]<br><p class=""text""><strong>[현장에서] 최하얀 정책금융팀 기자</strong></p><p class=""text"">지난 4일 정부가 ‘2024년 경제정책방향’을 발표했다. 경제정책방향은 우리 경제의 현재를 진단하고 앞으로 추진할 경제 정책을 정부가 두루 제시하는 일정이다. 통상 매년 12월 중순께 다음연도 경제정책방향이 발표되는데 이번엔 해를 넘겼다. 지난달 추경호 전 부총리 겸 기획재정부 장관을 비롯해 장관 6명을 총선으로 차출한 여파다. 새해 경제정책방향이 1월에 발표된 것은 2008년 기획재정부가 출범하고 처음 있는 일이다.</p><p class=""text"">발표 시일까지 미뤄가며 준비된 이번 경제정책방향은 여러모로 의미가 컸다. 우선 고금리·고물가 환경이 길어지고 우리 경제의 회복 속도가 더딘 상황에서 출범한 최상목 새 부총리 등 ‘2기 경제팀’의 데뷔 무대였다. 윤석열 정부가 임기 중반인 3년 차에 들어선 만큼, 이전보다 더 밀도 있는 정책 과제를 구체적으로 제시하리란 기대도 없지 않았다. 무엇보다 잠재성장률 추락과 인구구조 변화 등 구조적 위기에 맞선 ‘윤석열표 솔루션’이 등장할 마지막 기회로 여겨졌다. 이런 고차 방정식 과제는 추진에 오랜 시일이 걸리고 복잡한 사회적 합의 절차도 필수인 까닭에 임기 후반에 실행하는 건 불가능에 가깝기 때문이다.</p><p class=""text"">그러나 ‘민생토론회’ 형식으로 떠들썩하게 발표된 2024년 경제정책방향은 맹탕에 가까웠다. 정부가 앞세운 설비·연구개발(R&amp;D) 투자기업들에 대한 세액공제 확대나, 비수도권 개발 부담금 완화, 소비증가분에 대한 추가 소득공제, 바나나 등 국외 과일 30만톤 신속 수입, 영세소상공인 전기료 감면 등은 모두 눈앞에 닥친 경기 대응 성격의 정책들이다. 그마저도 대부분은 효과를 알 수가 없고, 중장기 시야에선 고령화 등으로 돈 쓸 데가 늘어나는 정부의 세수 여력을 깎아먹는 대책들이다.</p><p class=""text"">올해 경제정책방향 53페이지 어디에도 담기지 않은 금융투자소득세 폐지가 급발표 된 점도 짚어두어야 할 대목이다. 경제정책방향 대국민 발표를 이틀 앞둔 지난 2일, 출입기자들에게 그 내용을 사전 설명하기 위한 브리핑장에서는 ‘윤 대통령, 금융투자소득세 폐지 추진’이란 속보가 더 많은 시선을 끌었다. 이미 반도체 투자세액공제 확대, 알앤디 예산안 삭감, 공매도 한시 금지 등 ‘용산 뜻’으로 급작스레 정책 흐름이 바뀌는 것이 벌써 여러 번인 터. 기존 계획표에 없던 표심잡기용 급발진 대책이 앞으로도 계속 나타날 거란 우려가 나오는 것도 과하지 않다.</p><p class=""text"">윤석열 정부의 철학이 녹진하게 달라붙은, 한국 경제의 구조적 문제에 대한 해법을 두고 각계각층의 한 판 고민과 논쟁을 추동할 그런 굵직한 경제 정책은 어디로 갔을까. 총선을 앞두고 여론의 반발을 살까 두려워 숨겨놨을까, 아니면 애초 제작할 의지조차 없는 것일까. 진영과 찬반을 떠나 훗날 ‘그 정책은 윤석열 정부에서 시작되었지’라고 회고하게 될 윤석열표 솔루션을 기다린다.</p><p class=""text""><a href=""mailto:chy@hani.co.kr"">chy@hani.co.kr</a></p>",https://www.hani.co.kr/arti/economy/economy_general/1123357.html,"윤 대통령, 총선 앞 금투세 폐지 카드로 2030 표심 잡기",https://www.hani.co.kr/arti/politics/politics_general/1122700.html,https://flexible.img.hani.co.kr/flexible/normal/212/127/imgdb/child/2024/0102/53_17041861305817_20240102503277.jpg,대기업·고소득자에 ‘감세 보따리’…R&D·신용카드 공제 늘려,https://www.hani.co.kr/arti/economy/economy_general/1123040.html,https://flexible.img.hani.co.kr/flexible/normal/212/127/imgdb/child/2024/0104/53_17043598795488_20240104503473.jpg,대기업 R&D 공제 역대 최대…또 감세로 경기 띄우기,https://www.hani.co.kr/arti/economy/economy_general/1123037.html,https://flexible.img.hani.co.kr/flexible/normal/212/127/imgdb/child/2024/0104/53_17043593333083_20240104503462.jpg,,,,,,
경제,금융·증권,"금리, 기대와 현실 사이",2024-01-08 07:00,https://flexible.img.hani.co.kr/flexible/normal/970/609/imgdb/original/2023/1121/20231121503655.jpg,제롬 파월 미국 연방준비제도이사회 의장이 2023년 11월1일 미국 워싱턴에서 열린 금리정책 회의 뒤 기자회견을 하고 있다. REUTERS,"[%%IMAGE1%%]<br><p class=""text"">연초 금융시장 분위기가 우울하다. 지난해 11월 시작된 자산가격 랠리가 계속될 것이라던 기대감이 사라지고 있다. 그 중심에 금리가 있다. 빠르게 떨어졌던 주요국 금리가 재차 꿈틀대면서 자산시장도 덩달아 민감한 반응을 보이고 있다. 지난해에 이어 올해에도 금리가 자산가격의 ‘게임 체인저’ 역할을 할 전망이다.</p>[%%IMAGE2%%]<br><p class=""text"">관심은 미국 국채 금리가 재차 추세적 상승세로 돌아설지 여부지만 그 가능성은 낮다. 물가 상승 폭이 재차 커지는 현상을 경계하는 목소리도 일부 있지만 디스인플레이션 기조가 크게 흔들리고 있음을 시사하는 지표나 이벤트는 없다. 연초 중동 지정학적 리스크로 유가가 반등했지만 그래도 배럴당 70달러 초반 수준이다. 탄탄한 고용지표가 다소 거슬리나 물가 압력을 다시 자극할 정도는 아니다.</p><p class=""text"">다만 금리인하를 바라보는 금융시장과 미국 연방준비제도(연준) 시각에 큰 간극이 있음을 부인하기 어렵다. 중앙은행 생각보다 금융시장이 너무 앞서가고 있다는 불안감이 연초부터 대두되면서 시장금리 반등으로 나타난 것이다. ‘3월 금리인하’는 금융시장의 희망에 그칠 공산이 높다. 자산시장 과열 현상을 막기 위해서도 미 연준은 너무 빠른 금리인하를 선택하지 않을 것이다.</p><p class=""text"">시각 차이는 시간을 두고 좁혀가면 된다. 그 과정에서 국채 금리 변동성이 확대될 수 있지만 지난해 4분기 초에 나타났던 금리 급등에 따른 긴축발작 현상과는 현격한 차이가 있다. 등락은 있겠지만 금리의 무게 중심은 하락에 있다.</p><p class=""text"">기대 중요한 것은 현실이다. 올해 자산가격 흐름을 좌우할 두 핵심축은 금리인하와 경기 연착륙이다. 다행히 이들 두 축은 흔들리지 않고 있다. 시간이 좀 더 필요하지만 미국 물가 수준은 미 연준 목표치에 점진적으로 다가설 것이다. 에너지 가격 안정에 이어 뜨거웠던 고용시장과 임대시장 열기가 식고 있어 물가는 머지않아 마지막 허들을 넘을 것으로 보인다. 경기 역시 침체보다 연착륙에 다가서고 있다. 역설적이게도 견조한 고용시장이 물가에는 부담을 주고 있지만 경기 연착륙에는 큰 역할을 담당하고 있다.</p><p class=""text"">기대가 아닌 현실을 고려할 때 미 연준은 3월이 아니라 5월 혹은 6월에 금리인하에 나설 것으로 보인다. 이는 금융시장과 경기에 긍정적 영향을 줄 것이다. 과거 미 연준의 금리인하는 경기침체에 따른 ‘리세션 컷’(경기침체 인하)이 대부분이었다. 당연히 금리인하가 당장 자산시장에 긍정적 영향을 미치기 어려웠다. 경기가 안 좋은데 금리인하가 만병통치약이 되기 힘들었기 때문이다. 반면 이번에 미 연준이 금리에 나선다면 찾아보기 힘들었던 ‘디스인플레이션 컷’(물가하락 금리인하)이 될 것이다. 경기 연착륙 상황에서 금리마저 하락한다면 자산시장에 긍정적으로 기여할 것이다.</p><p class=""text"">기대만 가지고는 자산가격의 랠리가 지속되기 어렵다. 다행스러운 것은 기대가 점차 현실화될 가능성이 크다는 것이다. 긴 호흡으로 연초 냉랭한 분위기를 이겨내야 한다.</p><p class=""text"">하이투자증권 전문위원</p>",https://www.hani.co.kr/arti/economy/finance/1123356.html,"금리 올해는 내려가려나, 살아남으면 봄이 온다",https://www.hani.co.kr/arti/economy/economy_general/1123113.html,https://flexible.img.hani.co.kr/flexible/normal/212/127/imgdb/child/2024/0105/53_17044138300469_20231219503472.jpg,줄줄이 내리는 예금 금리…대출 금리는 언제쯤?,https://www.hani.co.kr/arti/economy/finance/1122517.html,https://flexible.img.hani.co.kr/flexible/normal/212/127/imgdb/child/2024/0101/53_17040934596983_20240101501672.jpg,금리 내리면 집값 상승?… 초등생 급감 등 구조적 변화도 봐야,https://www.hani.co.kr/arti/economy/property/1122746.html,https://flexible.img.hani.co.kr/flexible/normal/212/127/imgdb/child/2024/0103/53_17042373087523_20240102503681.jpg,,,,,,
경제,금융·증권,은행 의결권 다 합쳐도 33%…태영 채권단의 표심은 어디로,2024-01-08 05:00,https://flexible.img.hani.co.kr/flexible/normal/970/647/imgdb/original/2024/0107/20240107502017.jpg,7일 서울 영등포구 태영건설 본사. 연합뉴스,"[%%IMAGE1%%]<br><p class=""text"">태영건설의 법정관리 가능성이 불거지는 건 주채권은행인 산업은행이 태영건설의 운명을 결정할 채권단협의회에서 갖는 의결권 비중이 작다는 점도 한몫한다. 일부에선 산은 이외 민간 은행들이 반대매수청구권 행사에 나설 수 있다는 관측도 나온다.</p><p class=""text"">태영건설 워크아웃 과정을 주도하는 산업은행은 태영건설의 주채권은행이다. 하지만 워크아웃의 향방을 결정할 전체 채권단협의회에서 갖는 의결권은 3.3%(신용공여액 기준)에 그친다. 산은을 포함해 은행권의 의결권도 약 33%다. 워크아웃 개시를 의결하려면 전체 채권단의 75%가 찬성해야 한다. 은행권이 워크아웃 개시에 뜻을 모으더라도 나머지 채권자 42%의 동의를 끌어와야 하는 셈이다. 채권단에 속한 한 금융회사 관계자는 “5대 금융지주 계열사 의결권을 모두 합하면 28%, 건설공제조합 등 조합의 의결권은 20% 정도에 그친다”며 “한마디로 채권자가 아주 폭넓게 분산돼 있다”고 말했다.</p><p class=""text"">이는 과거 워크아웃 사례와는 차이가 크다. 과거엔 산은 등 특정 은행의 의결권 비중이 커 워크아웃 개시 등 주요 의사결정에서 주채권은행의 의중이 가장 중요했고 그 영향력도 절대적이었다. 2001년 현대건설 워크아웃 당시 산업은행 의결권은 22.7%, 2014년 팬택 워크아웃 때는 의결권 비중이 40%에 이르렀다. 기업금융 비중이 큰 우리은행과 하나은행(옛 외환은행)의 의결권도 적지 않았다. 소수의 채권은행만 입 맞추면 워크아웃은 순항하는 구조였던 셈이다.</p><p class=""text"">태영 워크아웃에선 또 다른 특수성도 있다. 채권자가 많을 뿐만 아니라 채권자 간 이해도 엇갈릴 수가 있어서다. 워크아웃 개시 이후 신규 자금을 투입해야 할 공산이 있는 주요 채권은행은 선순위 채권 비중이 높고 담보권을 확보한 상태다. 워크아웃에 반대표를 던지는 게 더 유리할 수 있다는 얘기다. 구체적으로 워크아웃이 개시되더라도 반대표를 던진 채권자는 반대매수청구권을 행사해 채권을 회수할 기회를 얻을 수 있고, 태영건설이 법정관리(기업회생절차)로 가더라도 담보권을 행사해 채권 상당액을 회수할 수 있다.</p><p class=""text"">물론 현실적으로 산은 결정과 별개로 여타 은행들이 독단적인 결정을 내리기는 어려울 수 있다. 4대 은행의 한 고위 임원은 “태영그룹의 기존 자구안이 부족한 탓에 우리 입장에선 워크아웃 개시가 마뜩잖은 게 사실”이라면서도 “개별 은행 사정만 따지기도 어렵다”고 말했다. 5대 금융지주의 한 캐피탈사 관계자는 “태영 채권자인 그룹 내 계열사가 3곳이다. 계열사마다 의사 결정을 달리하기도 쉽지 않아서 지주(그룹) 차원의 방침을 기다리고 있다”고 말했다.</p><p class=""text"">남지현 기자 <a href=""mailto:southjh@hani.co.kr"">southjh@hani.co.kr</a></p>",https://www.hani.co.kr/arti/economy/finance/1123350.html,이복현 “남의 뼈 깎는 태영 자구안…홀딩스 내놔라” 최후통첩,https://www.hani.co.kr/arti/economy/finance/1123041.html,https://flexible.img.hani.co.kr/flexible/normal/212/127/imgdb/child/2024/0104/53_17043622213063_20240104503475.jpg,"윤석민 태영 회장, 돌연 약속 파기…개인자금 416억 TY홀딩스로 돌려",https://www.hani.co.kr/arti/economy/economy_general/1123191.html,https://flexible.img.hani.co.kr/flexible/normal/212/127/imgdb/child/2024/0105/53_17044418410384_20240105502009.jpg,태영 믿지 못 믿는 채권은행들 “경영권 유지에만 관심”…워크아웃 무산 경고,https://www.hani.co.kr/arti/economy/economy_general/1123201.html,https://flexible.img.hani.co.kr/flexible/normal/212/127/imgdb/child/2024/0105/53_17044467930853_20240105502140.jpg,"태영그룹, 추가 자구안 낸다…“총수 일가 사재 출연 담길 듯”",https://www.hani.co.kr/arti/economy/finance/1123334.html,https://flexible.img.hani.co.kr/flexible/normal/212/127/imgdb/child/2024/0107/53_17046359430024_20240103503138.jpg,태영 쇼크에 돈줄 마를라…건설업계 ‘우려 불식’ 총력전,https://www.hani.co.kr/arti/economy/finance/1123346.html,https://flexible.img.hani.co.kr/flexible/normal/212/127/imgdb/child/2024/0107/53_17046321451179_20240107501935.jpg
