대분류,중분류,제목,작성시간,썸네일 이미지,썸네일 캡션,본문,기사주소,관련기사 제목1,관련기사 주소1,관련기사 이미지1,관련기사 제목2,관련기사 주소2,관련기사 이미지2,관련기사 제목3,관련기사 주소3,관련기사 이미지3,관련기사 제목4,관련기사 주소4,관련기사 이미지4,관련기사 제목5,관련기사 주소5,관련기사 이미지5
경제,경제일반,"신혼·생애최초 특공, 물량 줄어들기 전에 사전청약 노려봐야",2024-01-08 09:00,https://flexible.img.hani.co.kr/flexible/normal/640/419/imgdb/original/2024/0107/20240107502062.jpg,서울 마포구 일대 아파트단지. 김명진 기자 littleprince@hani.co.kr,"[%%IMAGE1%%]<br><p class=""text"">2024년 첫 수도권 공공주택 사전청약 일정이 이달 15~23일로 다가왔다. 이번 사전청약에는 한국토지주택공사(LH)와 서울주택도시공사(SH)가 서울과 3기 새 도시를 포함한 8곳에서 총 4734가구를 공급해, 청약을 기다려왔던 실수요자의 내 집 마련 기회가 많을 것으로 예상된다. 특히 오는 3월께부터는 출산 장려를 위한 ‘신생아 특공’이 신설되는 등 청약제도 변경도 예정돼 있어, 배정 물량이 줄어드는 신혼부부, 생애최초 특별공급 대상자는 이번 기회를 적극 활용해볼 만하다.</p><div class=""cont-midtitle type2""><p class=""text"">서울 3곳, 3기 새도시 대장주 ‘창릉’ 눈길</p></div><p class=""text"">이번 사전청약에선 서울 위례, 서울 마곡지구, 고양창릉, 남양주왕숙2, 수원당수 등 5곳의 2277가구가 나눔형으로, 서울 대방 공공주택지구 815가구가 일반형으로 공급된다. 화성동탄2, 고양창릉, 부천대장 등 3곳의 1642가구는 선택형으로 나왔다. 수요층이 두터운 서울에서 3곳이 나와 눈길을 끌고, 3기 새 도시의 ‘대장주’로 꼽히는 고양 창릉에선 나눔형과 선택형이 동시에 공급된다.</p><p class=""text"">나눔형은 분양가가 시세의 70% 이하로 일반형보다 저렴하고 분양가의 80%까지 최대 40년간 저금리 주택담보대출이 지원된다. 의무 거주 기간(5년) 이후 사업시행자(LH)에게 환매할 수 있고 이 경우 처분 손익의 70%가 수분양자에게 귀속된다. 선택형은 6년 우선 임대 거주 후 분양을 선택할 수 있는 유형으로, 분양 전환 시 나눔형과 동일하게 장기 저금리 대출이 지원된다. 일반형은 분양가가 시세의 80% 수준으로 높은 반면 처분 손익에 대한 공공 귀속은 없는 유형이다.</p><p class=""text"">나눔형의 추정 분양가는 서울 위례지구(전용면적 60㎡ 이하) 5억~6억원대, 나머지 지구는 60㎡ 이하 3억원대, 74~84㎡ 4억~5억원대다. 일반형은 서울 대방 59㎡ 7억원대, 84㎡ 10억원대로 산출됐다. 선택형의 추정 임대료는 60㎡ 이하 월 50만~60만원대, 74~84㎡ 80만~90만원대 수준이다. 토지임대부 주택으로 나온 서울 마곡지구 16단지는 59㎡ 분양가가 3억5900만원, 토지 임대료(추정)가 월 58만원 수준이다.</p><p class=""text"">윤석열 정부의 공공분양주택인 ‘뉴홈’ 사전청약은 2022년 12월부터 지난해 9월까지 세 차례에 걸쳐 시행됐고 이번이 네번째 공급이다. 그동안 3차례 사전청약에서는 총 7600가구 공급에 20만명 이상이 신청해 평균 경쟁률 27대 1을 기록했다. 신청자의 75%를 20~30대가 차지하는 등 청년층의 호응이 컸으며 특히 19~39살 미만 미혼 청년 무주택자들을 위해 신설된 청년 특별공급은 경쟁률이 45.6대 1에 달했다. 기존 공공분양에 견줘 뉴홈의 20~30대 청약률이 높아진 것은 청년 특공이 신설되고 신혼부부 특공이 확대된 영향이 컸다.</p>[%%IMAGE2%%]<br><div class=""cont-midtitle type2""><p class=""text"">‘신생아 특공’, ‘복수 청약’ 변수 활용해야</p></div><p class=""text"">이번 사전청약에선 영등포구 대방동 공공주택지구, 강서구 마곡지구, 송파구 위례지구 등 서울에서만 3곳이 나와 주목을 끈다. 유일하게 일반형으로 나온 대방동 공공주택 A1블록은 지하철 1호선, 7호선, 9호선, 신림선이 인접한 교통 요지로, 기다려온 수요층이 상당히 많은 곳으로 꼽힌다. 분양가는 전용면적 59㎡가 7억7700만원, 84㎡가 10억8300만원으로, 인근 상도래미안1차 전용 84㎡(3층)의 지난해 12월 실거래가(9억8천만원)에 견줘 다소 비싼 분양가 수준이다.</p><p class=""text"">서울주택도시공사(SH)가 나눔형으로 공급하는 위례지구 A-14블록은 지하철 5호선 거여역과 마천역 인근인 북위례 생활권으로, 이 일대는 청약 수요가 많은 곳으로 정평이 나 있다. 토지임대부 주택인 서울 마곡지구 16단지는 9호선·공항철도 마곡나루역을 도보권으로 이용 가능한 거리로 입지가 양호하다. 건물만 분양받고 토지는 임대료를 내는 토지임대부 주택에 대해선 수요자들의 호불호가 엇갈리지만 마곡지구라는 입지가 이를 상쇄하고 있다는 게 시장의 평가다. 지난해 10월 사전예약을 받았던 마곡지구 10-2단지(59㎡ 260가구) 토지임대부 주택은 당시 예상을 뛰어넘는 69.4대 1의 높은 청약 경쟁률을 기록해 화제를 모았다.</p><p class=""text"">수도권 공급물량 가운데는 고양창릉, 남양주왕숙2, 부천대장, 화성동탄2 등이 인기지역으로 손꼽힌다. 고양창릉은 서울 접근성, 교통여건 등에서 양호해 사전청약 때마다 높은 청약률을 보이고 있고, 남양주왕숙2와 부천대장, 화성동탄2도 20~30대 수요층의 관심이 높을 전망이다. 화성동탄2 C1블록의 경우 광역급행철도 GTX-A 동탄역에서 500m 거리에 있어, 서울 강남권 출퇴근이 편리한 곳으로 주목된다.</p><p class=""text"">신혼부부 특공, 생애 최초 특공 대상인 수요자는 오는 3월께부터 신설되는 ‘신생아 특공’을 고려해야 한다. 출산 장려를 위해 도입되는 신생아 특공은 만 2살 이하 자녀가 있는 가구에 나눔형 35%, 선택형 30%, 일반형 20%의 물량을 새로 배정한다. 신생아가 없는 신혼부부, 청년 등이라면 3월 이후 특공 물량이 줄어들기 때문에 제도 변경 직전 이번 사전청약을 적극적으로 노릴 필요가 있다.</p><p class=""text"">중복 청약도 활용해볼 만하다. 수요자는 당첨자 발표일이 다른 단지에 중복으로 청약할 수 있고, 발표일이 앞선 단지 당첨이 유효로 처리된다. 이번에는 에스에이치가 공급하는 마곡·위례지구 당첨자 발표일이 이달 31일로 가장 빠르고, 엘에이치가 공급하는 물량은 일반형(3월 13일)·나눔형(3월 20일)·선택형(3월 22일)의 당첨자 발표일이 유형별로 다르다. 적게는 2곳부터 많게는 4곳까지 복수 청약이 가능한 셈이다.</p><p class=""text"">최종훈 기자 <a href=""mailto:cjhoon@hani.co.kr"">cjhoon@hani.co.kr</a></p>",https://www.hani.co.kr/arti/economy/economy_general/1123371.html,‘뉴홈’ 사전청약 경쟁률 마곡 69.4대 1…20~30대 몰렸다,https://www.hani.co.kr/arti/economy/property/1112926.html,https://flexible.img.hani.co.kr/flexible/normal/212/127/imgdb/child/2023/1020/53_16978048111604_20200202501412.jpg,,,,,,,,,,,,
경제,IT,과거 보여주면 미래를 점치는 인공지능,2024-01-08 09:00,https://flexible.img.hani.co.kr/flexible/normal/700/359/imgdb/original/2023/1203/20231203501549.jpg,개인의 노트북과 스마트폰 등에서 생성형 인공지능(AI) 구현되는 온디바이스 인공지능 시대가 성큼 다가왔다. 연합뉴스,"[%%IMAGE1%%]<br><p class=""text"">인공지능은 사람의 과거를 기반으로 미래를 예측할 수 있을까?</p><p class=""text"">과학자들이 도전에 나섰다. 지난해 12월 ‘<a class=""linkstyle-u"" href=""https://www.nature.com/articles/s43588-023-00573-5"">네이처 컴퓨터과학</a>’에 따르면, 덴마크 공대와 코펜하겐대, 미국 노스이스턴대 합동연구진은 살면서 맞닥뜨리는 여러가지 일들을 토대로 생존률을 예측하는 실험을 진행했다. 연구 대상은 덴마크 국가등록부에 저장된 600만명의 데이터다. 여기엔 나이·주거지, 교육과 소득, 직업과 직장, 근무시간과 같은 개인정보, 신체정보, 질병 등의 건강 정보가 포함돼 있다.</p><p class=""text"">연구 방식이 흥미롭다. 이들은 600만명의 개별 데이터를 정형화된 데이터베이스로 가공하지 않았다. 그대신 이들은 개인의 삶을 서술한 문장을 통째로 이해하는 인공지능 거대언어모델(LLM)을 썼다. ‘2020년 9월, 프란시스코는 엘시노레의 성에서 경비원으로 2만 크로네를 받았다’는 문장을 직업이나 소득 등으로 해체·분류하지 않고 통째로 인공지능에게 학습시켰다. “개인의 삶을 서술한 문장은 유형별로 분류된 데이터보다 더 광범위하고 상세한 정보를 담고 있을 거야”라는 가설을 믿고 연구진은 2008년부터 2015년까지 30~55살 덴마크 국민 600만명의 데이터를 분석한 뒤, 4년 뒤인 2020년까지 생존 가능성을 예측했다. 30~55살을 고른 건, 이 나잇대가 사망률 예측이 어려운 젊은 집단이기 때문이다. 결과도 기대 이상이었다. 조기사망률 예측에선 이들의 ‘라이프투벡’(Life2vec) 모델이 최신 순환신경망(RNN) 모델보다 11% 더 정확한 결과를 보였다. 삶의 변곡점에 중요한 영향을 미치는 성격 검사에서도 라이프투벡 모델은 기존 성격테스트 모델보다 정확한 예측률을 보였다. 엠비티아이(MBTI) 같은 성격 검사도 자연스런 대화로 진행할 수 있다는 얘기다.</p><p class=""text"">한계도 명확하다. 이 연구는 4년 뒤의 생존 확률을 학습에 기반해 제시했다. 변수를 고려해 예측 확률을 높였다고는 하지만, 삶은 예측을 빗나갔다고 해서 무를 순 없다. 자연재해나 교통사고처럼 개인의 사회적 정보나 건강 정보와 무관하게 삶을 뒤흔드는 변수들도 무수하다. 또 연구 대상인 600만명 가운데는 이민자나 행방불명자처럼 이미 삶의 방향이 바뀐 이들도 포함돼 있다. 이를 반영해 실험 결과를 보다 면밀하게 조정해야 하는 작업이 남았다.</p>[%%IMAGE2%%]<br><p class=""text"">실험 결과보다 놀라운 건 연구 방법론이다. 이번 연구는 인공지능 트랜스포머 모델을 사회경제적 데이터로 확장했다는 점에서 새롭다. 도시에서 시골로 이사하거나 급여가 오른 사실이 심장마비를 일으킬 확률과 얼마나 연관이 있을까. 사회복지 혜택을 받거나 직장을 옮겼을 때는 어떤 변수가 생길까. 정형화된 수치와 공식으로는 설명하기 어려웠던 삶의 변수를 연구진은 대화하듯 풀어내며 한발짝식 접근했다. 그 결과, 잘 구조화된 데이터보다 확률적으로 의미 있는 결과를 만들어냈다. 학습용 데이터를 사람이 일일이 가공할 필요 없이 자연어 그대로 학습시켰다는 점에서 이번 실험은 거대언어모델(LLM) 기반의 새로운 연구법을 제시했다. 무엇보다 예전에는 데이터라 부르기 힘들었던 일상의 ‘이벤트’들이 삶의 변화와 상관관계를 맺을 수 있다는 가능성을 보여줬다.</p><p class=""text"">미래는 알 수 없지만 삶에 영향을 미치는 요인들을 좀더 명확하게 밝힌다면, 마음의 위로를 넘어 개인별 맞춤 치료도 가능해지지 않을까.</p><p class=""text"">이희욱 미디어랩부장 <a href=""mailto:asadal@hani.co.kr"">asadal@hani.co.kr</a></p>",https://www.hani.co.kr/arti/economy/it/1123369.html,,,,,,,,,,,,,,,
경제,IT,76개국 슈퍼 선거의 해…‘딥페이크’ 민주주의에 치명상 입힐라,2024-01-08 09:00,https://flexible.img.hani.co.kr/flexible/normal/600/459/imgdb/original/2024/0107/20240107502068.jpg,트럼프 전 미국 대통령이 자신을 체포하려는 경찰로부터 도망가는 모습을 담은 인공지능으로 만든 가짜 사진. 엑스(X·전 트위터) 캡처,"[%%IMAGE1%%]<br><p class=""text"">2024년은 세계 76개국에서 선거가 치러지는 ‘슈퍼 선거의 해’다. 이 중 세계의 관심이 집중된 미국 대선은 인공지능을 활용한 딥페이크가 본격 동원되는 사상 최초의 선거가 될 가능성이 크다. 딥페이크를 활용하면 유권자의 관심을 높이고 홍보 비용을 줄일 수 있어 효율성이 커진다. 하지만, 정치 양극화와 혐오에 편승해 네거티브 확산 및 선거 조작으로 이어질 수 있어 우려가 제기된다.</p><p class=""text""><strong>■ 딥페이크와 선거 조작</strong></p><p class=""text"">지난해 10월30일 바이든 미국 대통령은 인공지능 개발을 규제하는 행정명령에 서명했다. 인공지능이 만들어낸 콘텐츠에 ‘AI 사용’이라는 표시를 하고, 콘텐츠 출처를 확인하는 기술 표준도 마련하도록 지시했다. 대선을 앞두고 생성형 인공지능으로 제작된 딥페이크를 통해 허위정보가 걷잡을 수 없이 확산할 수 있다는 우려도 배경이다. 바이든 대통령은 자신이 서점에서 치매 관련 책을 고르는 것처럼 조작된 영상 등을 보고 큰 충격을 받은 것으로 전해진다. 인공지능이 인류에게 혜택을 줄지, 재앙으로 이어질지는 의견이 엇갈리는 미래의 일이지만, 선거와 정치에 미칠 영향은 당장 벌어질 현실이다.</p><p class=""text"">지난해 5월, 튀르키예 대선에서는 투표 직전 ‘테러 집단이 야당 후보를 지지한다’는 딥페이크 영상이 퍼졌다. 조작된 영상이 집권당 승리에 결정적 영향을 줬다는 게 일반적 평가다. 지난해 9월 슬로바키아 총선에서도 비슷한 일이 일어났다. 투표 이틀 전, 친미 성향의 야당 대표가 “우리 당이 선거에 이기려면 (소외 계층인) 로마족에게 돈을 줘야 한다”고 말한 음성파일이 공개되었다. 곧 가짜로 판명되었지만, 집권당 승리에 큰 영향을 미친 것으로 알려졌다. 혐오를 부추기는 네거티브 선동과 허위정보가 딥페이크라는 첨단 기술과 만나 사실상 선거 결과를 조작한 셈이다.</p><p class=""text"">미국 대선에서도 이미 조작된 영상을 이용한 선거운동이 활개를 치고 있다. 미국 공화당전국위원회가 지난해 5월 공개한 선거 광고에는, 미군이 중무장한 채 샌프란시스코 거리를 순찰하는 장면, 이민자들이 남부 국경을 점령한 장면 등이 나온다. 조작된 가짜 이미지들을 통해 유권자들은 바이든 행정부에서 일어나는 디스토피아를 현실처럼 느낄 수 있다.</p><p class=""text"">통상 선거에서 정당이나 후보자들은 상대를 깎아내리고 부정적 측면을 강조하는 네거티브 유혹에 시달린다. 정책이나 비전 등을 내세우는 방법보다 손쉽게 표를 얻을 수 있다고 여겨서다. 네거티브 전략이 허위정보를 담은 딥페이크를 타고 확산할 경우 기존 선거 운동 방식은 무용지물이 될 수 있다.</p>[%%IMAGE2%%]<br><p class=""text"">■ <strong>정치불신과 민주주의 위기 </strong></p><p class=""text"">2016년과 2020년 미국 대선은 ‘소셜미디어 선거’로 통한다. 허위정보가 소셜미디어를 통해 확산하면서 선거 결과에도 큰 영향을 미쳤다. 미국 인터넷 뉴스 ‘버즈피드’에 따르면 2016년 대선에서 인기를 끌었던 가짜뉴스들은 소셜미디어에서 주요 언론이 생산한 기사보다 더 급속히 확산했고 파급력도 컸다.</p><p class=""text"">이제 인공지능을 활용하면 사람 기자 없이도 ‘뉴스봇’을 통해 허위정보나 가짜기사를 놀라운 속도로 쏟아낼 수 있다. 대량 생산된 가짜뉴스, 허위정보와 혐오를 담은 딥페이크가 소셜미디어를 타고 확산하면 진짜와 가짜의 구분 자체가 흐려진다. 무엇이든지 가짜일 수 있다고 의심하게 되면, 설령 진실이라도 받아들이기 불편한 내용을 ‘가짜뉴스’라고 치부해 거부하기 쉽다. 신뢰가 무너진 곳에서 민주주의 운명도 위태롭게 된다.</p><p class=""text"">전문가들은 언론과 정당에 대한 불신이 높은 나라일수록 딥페이크가 치명적 영향을 줄 수 있다고 말한다. 딥페이크로 조작된 ‘그럴듯한’ 가짜정보를 선택적으로 받아들여 극단화된 의견에 갇힐 경우, 정치 양극화는 더 악화할 수 있다. 또한 패배 진영은 불리한 이미지나 영상이 조작되었다고 주장하며 선거 결과에 불복하고 폭력 사태를 일으킬 수도 있다. 2020년 대선에서 트럼트 전 대통령이 선거에 불복하고 지지자들이 의회를 점거한 것에서도 확인된다.</p><p class=""text""><strong>■ 딥페이크 규제&nbsp;</strong></p><p class=""text"">한국도 지난 대선에서 ‘AI 윤석열’, ‘AI 이재명’ 등 딥페이크 영상이 등장해 관심을 끌었다. 하지만 이번 총선부터는 투표일 90일 이전부터 딥페이크를 이용한 선거운동이 전면 금지된다. 미국의 경우 지난달 30일 미국 시민단체 ‘퍼블릭 시티즌’에 따르면, 선거와 관련해 딥페이크 규제법이 마련된 곳은 텍사스·미시간·워싱턴·미네소타·일리노이 5개 주뿐이다. 연방 차원의 규제는 아직 확정된 것이 없다.</p><p class=""text"">규제 조치가 도입된다 해도 투표 직전 후보자를 비판하거나 공격하는 딥페이크가 등장해 선거 판도를 흔들 가능성은 여전히 남아 있다. 가령 바이든 대통령의 실격 사유를 암시하는 딥페이크가 투표일 직전에 공개될 경우 박빙의 선거에 치명적 영향을 줄 수 있다고 많은 전문가들은 우려한다.</p><p class=""text"">한귀영 사람과디지털연구소 연구위원 <a href=""mailto:hgy4215@hani.co.kr"">hgy4215@hani.co.kr</a></p>",https://www.hani.co.kr/arti/economy/it/1123368.html,,,,,,,,,,,,,,,
경제,기업PR,"서울여대 바롬인성교육연구소, 제12회 인성교육 학술토론회 진행",2024-01-08 08:38,https://flexible.img.hani.co.kr/flexible/normal/970/322/imgdb/original/2024/0108/2117046706338854.jpg,"&nbsp; &nbsp; &nbsp; &nbsp; &nbsp; &nbsp; &nbsp; &nbsp; &nbsp; &nbsp; &nbsp; &nbsp; &nbsp; &nbsp; &nbsp;서울여대 바롬인성교육연구소, 제12회 인성교육 학술토론회 진행.서울여대 제공","[%%IMAGE1%%]<br><p class=""text"">서울여자대학교 바롬인성교육연구소(소장 홍순혜)는 1월 5일(금) 서울여대 바롬인성교육관 1층 국제회의실에서 제12회 인성교육 학술토론회를 진행했다. 이번 학술토론회는 ‘학습자 중심 인성교육’을 주제로 초·중·고등학교와 대학 및 지역사회에서 학생들을 가르치는 현직 교원과 인성교육 전문가 100여명이 참석했다.&nbsp;<br>홍순혜 바롬인성교육연구소장은 “올해로 12회를 맞이한 ‘인성교육 학술토론회’를 통해 대학 및 공교육의 인성교육에 대해 오랫동안 연구하고 실천해 오신 교원을 비롯해, 가정, 학교, 지역사회에서 인성교육을 위해 힘쓰는 전문가들의 사례를 공유하며 인성교육의 방향과 창의적인 대안들을 공유하는 시간이 되길 바란다.”고 개회사를 전했다.&nbsp;<br>기조강연자인 고요한 연세대학교 RC융합대학 부학장은 ‘인성교육의 관점 전환-기관계에서 학생계로’를 주제로, 학교 인성교육이 교사·교수 중심의 연역적 차원, 기관계 관점이 아닌 학생계 관점으로 전환이 필요함을 강조하며, 인성교육의 출발은 개인적 차원에서 시작되지만 궁극적으로 사회·관계적 장면에서 행동하는 능력이 갖추어져야 한다. 이를 위해서는 인성을 갖춘 교사·교수의 인성교육 실천이 필수적임을 전했다.<br>이어진 주제발표는 서덕희 조선대학교 교육학과 교수가 ‘실천공동체 속에서 나다움의 형성을 위한 인성교육:자기존중-자기표현-자기성찰’를 주제로 진행하였고, 인성교육 사례발표에서는 ▲김수영 서울여대 교양대학 교수의 ‘학생과 함께 만들어가는 생활학습 공동체교육’ ▲김혜령 이화여자대학교 호크마교양대학 교수의 ‘대학 인성교육으로서의 가드닝 수업 ▲이상훈 원주 단관초등학교 교사의 ’교과연계 인성놀이 프로그램 운영 사례‘로 진행되어 다양한 관점의 발표자들이 경험한 인성교육 사례를 분석하고 실천 적용가능성을 나누었다.<br>바롬인성교육연구소에서는 “학생수가 급격히 줄어들고 아동청소년의 행복지수는 OECD국가 최하위권에 머물러 있는 현실 앞에 우리는 어떻게 살아야 하는지, 다음 세대를 어떻게 대해야 하는지 진지하게 고민하는 시간이 되었길 바란다.”며 토론회를 마무리했다.</p><p class=""text"">* 자료제공 : 서울여자대학교</p><p class=""text"">&lt;이 기사는 대학이 제공한 정보기사로, 한겨레의 의견과 다를 수 있습니다&gt;</p>",https://www.hani.co.kr/arti/economy/biznews/1123365.html,,,,,,,,,,,,,,,
