대분류,중분류,제목,작성시간,썸네일 이미지,썸네일 캡션,본문,기사주소,관련기사 제목1,관련기사 주소1,관련기사 이미지1,관련기사 제목2,관련기사 주소2,관련기사 이미지2,관련기사 제목3,관련기사 주소3,관련기사 이미지3,관련기사 제목4,관련기사 주소4,관련기사 이미지4,관련기사 제목5,관련기사 주소5,관련기사 이미지5
경제,금융·증권,태영 쇼크에 돈줄 마를라…건설업계 ‘우려 불식’ 총력전,2024-01-07 21:51,https://flexible.img.hani.co.kr/flexible/normal/859/516/imgdb/child/2024/0107/53_17046321451179_20240107501935.jpg,7일 서울 영등포구 태영건설 본사. 연합뉴스,"[%%IMAGE1%%]<p><p class=""text"">태영그룹이 8일 추가 자구안을 채권단에 제출할 예정이지만 워크아웃 무산에 따른 법정관리(기업회생절차) 가능성은 식지 않고 있다. 채권단 구성이 다양하고 이해관계도 다 다른 탓에 워크아웃 개시를 위한 조건(채권자 75% 동의, 신용공여액 기준)이 충족될지 가늠하기 어려워서다. 이에 따라 위기의 불길이 다른 건설사로 옮겨 갈 수 있다는 시장 분석도 나온다. 위험군으로 언급된 건설사들은 유동성이 충분하다며 해명자료를 내거나 관련 증권사 보고서가 수정되기도 한다.</p><p class=""text"">지난해 말 태영건설이 워크아웃을 신청할 때까지만 해도 금융시장에 끼치는 영향은 제한적이었다. 한 예로 태영건설 회사채 가격은 크게 떨어지는 와중에도 회사채 시장에서 금리 급등(가격 급락) 현상은 나타나지 않았다. 이는 워크아웃이 순항하면서 그 영향도 태영건설에 한정될 공산이 높다는 시각이 우세해서였다.</p><p class=""text"">새해 들어선 분위기가 달라지고 있다. 태영건설의 자구책을 놓고 채권단의 반발이 커지고 있어서다. 특히 태영건설이 워크아웃 신청에 앞서 채권단과 맺은 합의도 지키지 않은 것으로 확인되면서 채권단의 불만은 들끓었다. 당장 신용평가기관과 증권사들이 잇달아 보고서를 내어 ‘건설사 옥석 가리기’에 나섰다. 하나증권은 지난 4일 낸 보고서에서 “태영건설 외에도 프로젝트파이낸싱(PF) 우발채무 리스크와 미분양 리스크로 유동성이 빠르게 축소되는 위험 기업을 확인할 수 있다”며 “특히 롯데건설은 태영건설과 유사점이 있다”고 밝혔다. 한국신용평가는 롯데건설과 함께 지에스(GS)건설, 신세계건설, 에이치디씨(HDC)현대산업개발을 주요 모니터링 기업으로 꼽았다.</p></p>[%%IMAGE2%%][%%IMAGE3%%]<p><p class=""text"">거론된 기업들은 ‘우려 불식’에 총력을 다하는 중이다. 롯데건설은 하나증권 보고서가 나온 당일 “현금성 자산을 2조원 이상 보유하고 있다” “올해 1조6천억원의 우발채무를 줄여 안정적인 재무구조를 확보할 계획”이라는 등의 내용을 담은 해명성 보도자료를 냈다. 롯데건설을 짚은 하나증권 보고서는 현재 관련 내용이 삭제된 상태다. 하나증권 쪽은 한겨레에 “보고서를 작성한 애널리스트가 롯데건설만 (언론에서) 부각되는 것을 부담스러워해 내용을 삭제했다”고 말했다.</p><p class=""text"">올해 상반기 중 만기가 되는 건설사 회사채 규모는 약 2조5천억원이다. 피에프 부실 현실화로 신용등급이 강등되면, 회사채 차환 발행 부담이 급격히 높아진다. 김상수 한국신용평가 수석연구위원은 “일부 대형사를 제외하면 대부분 건설사가 직접 금융시장을 통한 자금 조달이 어렵다. 차입과 우발채무 부담이 큰 건설사를 중심으로 불안이 확산할 전망”이라고 말했다.</p><p class=""text"">증권시장에선 고수익을 노린 단타 현상이 나타나면서 주가 변동성이 높아지고 있다. 태영건설 주가는 워크아웃 신청 전날인 12월27일에는 19.57% 하락했지만, 지난 5일 현재 지난해 폐장 종가 대비 33.48% 올랐다. 특히 태영건설 우선주는 지난 2~4일 3거래일 연속 상한가를 쳤다. 신세계건설과 동부건설 주가는 올해 들어 연일 약세를 보이고 있다.</p></p>[%%IMAGE4%%]<p class=""text"">조해영 기자 <a href=""mailto:hycho@hani.co.kr"">hycho@hani.co.kr</a></p>",https://www.hani.co.kr/arti/economy/finance/1123346.html,,,,,,,,,,,,,,,
경제,금융·증권,"태영, 추가 자구책 막판 협상…직접 지원·사재 출연 담길 듯",2024-01-07 20:29,https://flexible.img.hani.co.kr/flexible/normal/970/647/imgdb/original/2024/0107/20240107501888.jpg,7일 서울 영등포구 태영건설 본사. 연합뉴스,"[%%IMAGE1%%]<br><p class=""text"">워크아웃 개시 결정을 앞둔 태영건설이 채권단과 추가 자구책을 두고 논의 중이다. 채권단 내에서는 태영건설이 기존에 제출한 자구안이 충분치 않다는 불만이 계속되는 상황이다.</p><p class=""text"">7일 금융권에 따르면 태영건설은 현재 주채권은행인 산업은행 등과 추가 자구안을 두고 물밑 협상 중이다. 정부 고위 관계자는 “태영건설이 추가 자구책을 내일(8일) 제출할 예정”이라며 “태영건설을 직접 지원하는 내용과 총수 일가의 사재 출연 등이 새로 들어간 것으로 보인다”고 말했다.</p><p class=""text"">태영건설 채권단은 오는 11일 워크아웃 개시 여부를 결정하는 협의회를 연다. 현재까지는 태영건설이 기존에 제출했던 자구책이 충분치 않다는 비판이 컸다. 이 때문에 금융당국은 물론이고 한덕수 국무총리도 7일 한 방송에 출연해 “경영자가 자기 뼈를 깎는 고통스러운 일을 해야 한다”고 말하는 등 태영건설의 추가 자구책에 대한 압박이 이어졌다. 태영건설은 워크아웃 신청 과정에서 채권단에 약속했던 태영인더스트리 매각대금 지원 등도 지키지 않은 상태다.</p><p class=""text"">태영건설은 8일 중으로 추가 자구책을 공식 제출할 것으로 알려졌다. 이 자구책이 채권단 75%(채권액 기준)의 동의를 얻는다면 11일 협의회를 거쳐 워크아웃 절차를 공식적으로 밟게 된다. 다만 추가 자구책의 내용이 구체적으로 알려지지 않은 상황이어서, 늑장으로 제출한 추가 자구책마저 채권단을 설득할 만한 수준이 아니라면 여전히 워크아웃 개시까지 난항이 계속될 수 있다.</p><p class=""text"">조해영 기자 <a href=""mailto:hycho@hani.co.kr"">hycho@hani.co.kr</a>, 전슬기 기자 <a href=""mailto:sgjun@hani.co.kr"">sgjun@hani.co.kr</a>, 남지현 기자 <a href=""mailto:southjh@hani.co.kr"">southjh@hani.co.kr</a></p>",https://www.hani.co.kr/arti/economy/finance/1123344.html,"[사설] 태영건설 ‘꼬리 자르기’ 의심, 정부·채권단 원칙 지켜야",https://www.hani.co.kr/arti/opinion/editorial/1123320.html,https://flexible.img.hani.co.kr/flexible/normal/212/127/imgdb/child/2024/0107/53_17046180890609_20240107501725.jpg,"태영그룹, 추가 자구안 낸다…“총수 일가 사재 출연 담길 듯”",https://www.hani.co.kr/arti/economy/finance/1123334.html,https://flexible.img.hani.co.kr/flexible/normal/212/127/imgdb/child/2024/0107/53_17046247931312_20240107501820.jpg,태영 믿지 못 믿는 채권은행들 “경영권 유지에만 관심”…워크아웃 무산 경고,https://www.hani.co.kr/arti/economy/economy_general/1123201.html,https://flexible.img.hani.co.kr/flexible/normal/212/127/imgdb/child/2024/0105/53_17044467930853_20240105502140.jpg,"윤석민 태영 회장, 돌연 약속 파기…개인자금 416억 TY홀딩스로 돌려",https://www.hani.co.kr/arti/economy/economy_general/1123191.html,https://flexible.img.hani.co.kr/flexible/normal/212/127/imgdb/child/2024/0105/53_17044418410384_20240105502009.jpg,이복현 “남의 뼈 깎는 태영 자구안…홀딩스 내놔라” 최후통첩,https://www.hani.co.kr/arti/economy/finance/1123041.html,https://flexible.img.hani.co.kr/flexible/normal/212/127/imgdb/child/2024/0104/53_17043622213063_20240104503475.jpg
경제,금융·증권,"태영그룹, 추가 자구안 낸다…“총수 일가 사재 출연 담길 듯”",2024-01-07 19:20,https://flexible.img.hani.co.kr/flexible/normal/970/544/imgdb/original/2024/0103/20240103503138.jpg,3일 오후 태영건설의 워크아웃 신청 관련 채권단 설명회가 열린 서울 산업은행 본점에 관련 안내가 나오고 있다. 연합뉴스,"[%%IMAGE1%%]<br><p class=""text"">워크아웃 개시 여부를 결정하는 태영건설 채권자협의회 회의를 사흘 앞두고 태영그룹 쪽이 추가 자구안을 내놓는다. 그룹 총수 일가의 사재 출연 등이 담길 것으로 알려졌다. 정부는 워크아웃(기업개선작업) 무산에도 대비하며 법정관리(기업회생절차)를 염두에 둔 대응 방안도 검토하고 있다.</p><p class=""text"">정부 고위 관계자는 7일 “태영그룹이 8일 추가 자구안을 제출하는 것으로 안다. 현 단계에서 구체적인 내용은 공개하기 어렵다”고 밝혔다. 채권단 고위 관계자도 “태영그룹과 물밑에서 꾸준히 협상을 진행하고 있다. 최종 자구안을 본 뒤 채권자들과 논의할 예정”이라고 말했다. 최상목 부총리 겸 기획재정부 장관과 이창용 한국은행 총재, 김주현 금융위원장, 이복현 금융감독원장도 8일 오전 회의(F4 회의)를 열어 태영의 추가 자구안을 살펴볼 예정이다.</p><p class=""text"">앞서 태영그룹 쪽은 이날 채권단에 태영인더스트리 매각대금 지원, 에코비트 매각 추진과 매각대금 지원 등 기존 자구안 이행 의사만 타진했다가 채권단으로부터 퇴짜를 맞은 것으로 알려졌다. 기존 자구안과 함께 태영그룹 총수 일가의 사재 출연 계획도 담아 추가 자구안을 제출하라는 취지다. 금융당국 관계자는 “아직 확정이 되지는 않았지만 추가 자구안엔 대주주 일가의 사재 출연안이 담기는 것으로 안다”고 말했다. 최근 이 금감원장은 워크아웃 개시의 조건 중 하나로 대주주 일가의 티와이홀딩스(태영건설 모회사) 보유 지분 출연을 언급한 바 있다.</p><p class=""text"">최근 3~4일 동안 정부의 여러 핵심 당국자가 연이어 태영그룹을 겨냥한 고강도 발언을 내놨다. 한덕수 국무총리도 이날 한 방송에 출연해 “(태영그룹) 경영자가 자기 뼈를 깎는 고통스러운 일을 해야 한다”고 말했다. 대통령실 고위 관계자도 한겨레에 “(태영그룹이) 워크아웃을 신청할 때 하겠다던 자금 유입을 (태영건설에) 하지 않고 있다. 일방적으로 지원해줄 수는 없다”고 말했다. 워크아웃 무산 가능성을 열어둔 발언인 셈이다. 이 금감원장은 지난 4일 “주말(7~8일)까지는 추가 자구안을 가져와야 한다”며 최후통첩성 발언을 내놨다.</p><p class=""text"">이제 워크아웃 개시 여부는 추가 자구안의 수준과 이에 대한 채권자들의 수긍 여부에 달려 있다. 채권단 관계자는 “추가 자구안에 대한 면밀한 검토와 논의가 필요하다. 모든 가능성은 열려 있다”고 말했다. 워크아웃을 개시하려면 채권자 75%(신용공여액 기준)의 동의가 필요하다.</p><p class=""text"">정부는 워크아웃 무산과 그에 따른 태영건설의 법정관리행도 염두에 두고 비상 대응 방안도 검토하고 있다. 태영건설이 법정행 기차를 타면 협력업체와 분양계약자, 채권단의 손실은 물론 자금조달시장을 중심으로 금융시장도 크게 흔들릴 위험이 있다. 현재 태영건설의 분양계약자는 1만9869가구이며, 협력업체는 581개사에 이른다. 금융당국 핵심 관계자는 “관계 부처와 함께 법정관리 가능성에 대비한 비상 대책을 준비하고 있다”고 말했다.</p><p class=""text"">&nbsp;</p><p class=""text"">전슬기 <a href=""mailto:sgjun@hani.co.kr"">sgjun@hani.co.kr</a> 남지현 기자 <a href=""mailto:southjh@hani.co.kr"">southjh@hani.co.kr</a> 김미나 기자 <a href=""mailto:mina@hani.co.kr"">mina@hani.co.kr</a></p>",https://www.hani.co.kr/arti/economy/finance/1123334.html,"[사설] 태영건설 ‘꼬리 자르기’ 의심, 정부·채권단 원칙 지켜야",https://www.hani.co.kr/arti/opinion/editorial/1123320.html,https://flexible.img.hani.co.kr/flexible/normal/212/127/imgdb/child/2024/0107/53_17046180890609_20240107501725.jpg,태영 믿지 못 믿는 채권은행들 “경영권 유지에만 관심”…워크아웃 무산 경고,https://www.hani.co.kr/arti/economy/economy_general/1123201.html,https://flexible.img.hani.co.kr/flexible/normal/212/127/imgdb/child/2024/0105/53_17044467930853_20240105502140.jpg,"윤석민 태영 회장, 돌연 약속 파기…개인자금 416억 TY홀딩스로 돌려",https://www.hani.co.kr/arti/economy/economy_general/1123191.html,https://flexible.img.hani.co.kr/flexible/normal/212/127/imgdb/child/2024/0105/53_17044418410384_20240105502009.jpg,이복현 “남의 뼈 깎는 태영 자구안…홀딩스 내놔라” 최후통첩,https://www.hani.co.kr/arti/economy/finance/1123041.html,https://flexible.img.hani.co.kr/flexible/normal/212/127/imgdb/child/2024/0104/53_17043622213063_20240104503475.jpg,[단독] “태영 막내딸 챙긴 계열사 매각대금 500억 내놔야”…채권단 압박,https://www.hani.co.kr/arti/economy/finance/1122978.html,https://flexible.img.hani.co.kr/flexible/normal/212/127/imgdb/child/2024/0104/53_17043493230006_20240104502425.jpg
경제,IT,"개통 4년 지나도, 삼성전자 사업장 안에도 ‘5G 음영’…“호구 된 기분”",2024-01-07 19:15,https://flexible.img.hani.co.kr/flexible/normal/800/533/imgdb/original/2024/0107/20240107501814.jpg,"2018년 11월20일, 5세대 이동통신 개통을 앞두고 과학기술정보통신부 장관이 이동통신 3사 관계자들과 5세대 이동통신 기지국 구축 현장을 찾아 기념촬영을 하고 있다. 과학기술정보통신부 제공","[%%IMAGE1%%]<br><p class=""text""><strong><a href=""https://page.stibee.com/subscriptions/70653"">☞한겨레 뉴스레터 H:730 구독하기.</a></strong> 검색창에 ‘h:730’을 쳐보세요.</p><p class=""text"">“4년 동안 줄곧 민원 넣으면서 ‘내년엔 되겠지’하며 기다렸는데…”</p><p class=""text"">30대 직장인 ㄱ씨는 엘지유플러스(LGU+)의 5세대(5G) 이동통신 요금제를 4년째 이용 중이다. 하지만 ㄱ씨는 일터에선 5세대 통신을 이용하지 못하고 있다. 일터인 삼성전자 화성사업자의 한 건물에선 5세대 통신 설비가 설치되지 않아서다. 그는 지난 4년 동안 통신사에 지속해서 민원을 제기했지만, ‘인프라 확충 중이니 기다려달라’는 답변만 받았다고 한다. 심지어 5세대 통신 요금을 내고도 사용하지 못한 데 대한 보상 요구도 거절됐단다. “망 구축도 어렵고 보상도 안 된다고 하니 호구가 된 기분입니다.” 그는 분통을 터뜨렸다.</p><p class=""text"">7일 한겨레 취재 결과, 이동통신 3사가 5세대 통신 ‘서비스 불가 지역’을 제대로 알리지 않으면서도 요금제 가입을 받고, 손해 배상에도 뒷짐지고 있다. ㄱ씨처럼 근무지 건물 등 주 생활지역이 ‘5세대 이동통신 서비스 가능 지역’인지 확인할 수 있는 방법은 현재 마땅치 않다. 통신사들이 전국 200개 ‘법정 동’을 기준으로 듬성듬성 ‘5세대 통신 커버리지 맵’(5세대 무선 네트워크 연결 현황 지도)만 공개해서다. 실제 ㄱ씨가 근무하는 삼성전자 화성사업장이 속한 ‘동탄 1동’은 5세대 통신 가능 지역으로 표기돼 있다. 물론 통신 3사의 5세대 통신 요금가입서는 “건물 내·지하·외곽지역 등에서 5세대 서비스 이용이 제한될 수 있다”라고 밝히고 있지만 소비자들은 이용 제한 지역을 알기 어렵다. ㄱ씨 일터에선 엘지유플러스는 물론 에스케이텔레콤(SKT)·케이티(KT) 고객도 5세대 통신을 못 쓴다.</p>[%%IMAGE2%%]<br><p class=""text"">이런 난맥상은 정부 조사에서도 확인된다. 지난해 12월27일 과학기술정보통신부와 한국지능정보사회진흥원이 함께 발표한 ‘2023년 통신서비스 커버리지 점검 및 품질평가’ <a class=""linkstyle-u"" href=""/arti/economy/it/1121962.html"" target=""_blank"" rel=""noopener"">결과</a>를 보면, 전국 180개 주요 시설의 5세대 통신 서비스 접속가능비율(이용자의 단말기가 안정적으로 5세대 이동통신 네트워크에 연결되는 비율, 낮을수록 서비스가 안 되는 음영지역이 넓음)을 점검한 결과, 90%를 밑도는 ‘5세대 접속 미흡 시설’이 3사 평균 20곳에 이른다. 구체적으로 케이티가 28곳, 에스케이텔레콤 17곳, 엘지유플러스 15곳이다. 또 5세대 이동통신 서비스 커버리지 맵을 실제 통신 품질과 비교한 결과, 이동통신 3사 평균 2.7개 법정 동에서 ‘과대 표시’가 확인됐다.</p>[%%IMAGE3%%]<br><p class=""text"">이는 대상을 샘플링해 점검한 수치로, 조사 대상을 전국 모든 시설로 확대하면 품질 미흡 시설 수치는 더 늘 공산이 높다. 김주호 참여연대 민생경제팀장은 “현재 정부는 5세대 공동망이 구축된 건물을 대상으로 품질 조사를 하고 있다. 공동망이 구축 안 되어 있는 건물이 어느 정도인지 조사 범위를 확대해야 한다”며 “사전에 5세대 가입 신청자들이 ‘서비스 가능 지역’을 확인할 수 있는 시스템을 통신 3사 모두 구축할 필요도 있다”고 말했다. 김 팀장은 “정부가 보상 가이드라인을 마련해 이를 이통 3사가 일괄적으로 적용하게 하는 방법도 고려해야 한다”고 말했다.</p><p class=""text"">박지영 기자 <a href=""mailto:jyp@hani.co.kr"">jyp@hani.co.kr</a></p>",https://www.hani.co.kr/arti/economy/it/1123333.html,,,,,,,,,,,,,,,
경제,쇼핑·소비자,"저비용 항공사, 국제선 탑승객 수 대형 첫 추월하나",2024-01-07 15:40,https://flexible.img.hani.co.kr/flexible/normal/800/533/imgdb/original/2024/0107/20240107501400.jpg,지난해 저비용항공사의 국제선 운송실적이 대형 양대항공사 실적을 넘어설 것으로 전망된다. 게티이미지뱅크,"[%%IMAGE1%%]<p><p class=""text"">지난해 국내 저비용항공사(LCC)를 이용해 국외를 오간 승객이 사상 처음으로 대한항공·아시아나항공 등 대형 항공사 국제선 이용객 수를 넘어설 것으로 보인다. 장거리 노선에 집중해온 대형 항공사와 달리, 일본·동남아 등 단거리 노선에 주력한 저비용항공사의 전략이 코로나19 엔데믹(풍토병화)에 따른 국외여행 수요 회복과 맞물린 결과로 풀이된다.</p><p class=""text"">7일 국토교통부 항공통계를 보면, 지난해 1~11월 국내 저비용항공사 9개사의 국제선 이용객은 모두 2178만6842명으로 집계됐다. 같은 기간 대한항공·아시아나항공 양대 항공사 이용객(2072만7930명)보다 105만명가량 웃도는 규모다. 12월 통계는 아직 집계되지 않았지만, 연말에도 국외여행 수요와 항공사 이용 양태가 달라지지 않았다는 점을 고려하면, 양대항공사가 최종 집계에서 우위를 점하기는 어려울 것으로 전망된다. 지금 추세대로라면, 저비용항공사는 출범 20년 만에 처음으로 국제선 탑승객 수에서 양대 항공사를 앞지르게 된다.</p><p class=""text"">이런 변화의 배경에는 항공사의 코로나19 엔데믹 전략 차이가 있다는 것이 항공업계 분석이다. 양대 항공사가 미주·유럽 등 장거리 노선과 화물 시장에 집중할 때, 저비용항공사는 일본·동남아 등 단거리 노선 운항을 공격적으로 늘리며 폭발하는 국외 여행 수요를 흡수했다는 것이다.</p><p class=""text"">실제로 코로나19 팬데믹(대유행) 전인 2019년만 하더라도 저비용항공사의 국제선 점유율(외항사 제외)은 44.1%로 양대항공사(55.9%)에 10%포인트 이상 낮았다. 특히 코로나19 유행이 한창이던 2021년, 저비용항공사의 국제선 점유율은 11.2%까지 쪼그라들었다. 하지만 국외여행 수요가 급증한 지난해(12월 제외)에는 점유율 51.2%를 기록하며 양대 항공사의 국제선 점유율(48.8%)을 뛰어넘었다.</p><p class=""text"">한편에서는 아시아나항공이 대한항공과의 기업결합 절차를 밟고 있는 탓에 노선을 적극적으로 확대하지 못한 점도 저비용항공사가 지난해 상대적으로 약진할 수 있었던 배경이라는 풀이도 나온다.</p><p class=""text"">김경욱 기자 <a href=""mailto:dash@hani.co.kr"">dash@hani.co.kr</a></p></p>",https://www.hani.co.kr/arti/economy/consumer/1123303.html,싸니까 저비용 항공사? 승객 기대와 실제 요금 차이 크다,https://www.hani.co.kr/arti/economy/consumer/1122926.html,https://flexible.img.hani.co.kr/flexible/normal/212/127/imgdb/child/2024/0104/53_17043336521873_20240104501143.jpg,베트남·대만·일본 8만~9만원…항공사 ‘승객잡기’ 경쟁,https://www.hani.co.kr/arti/economy/marketing/1112448.html,https://flexible.img.hani.co.kr/flexible/normal/212/127/imgdb/child/2023/1017/53_16975239283547_20231017502393.jpg,국제선 겨울 항공편 12% 늘린다…코로나 이전 93% 회복 전망,https://www.hani.co.kr/arti/economy/economy_general/1113777.html,https://flexible.img.hani.co.kr/flexible/normal/212/127/imgdb/child/2023/1026/53_16983046810647_20231026503004.jpg,현실 택한 아시아나…‘반쪽 합병’ 비판 속 남은 숙제는,https://www.hani.co.kr/arti/economy/marketing/1114751.html,https://flexible.img.hani.co.kr/flexible/normal/212/127/imgdb/child/2023/1102/53_16989182424464_20231102503584.jpg,,,
경제,산업·재계,“넷제로 세상 궁금하다면 SK 원더랜드로”,2024-01-07 14:48,https://flexible.img.hani.co.kr/flexible/normal/640/275/imgdb/original/2024/0107/20240107501172.jpg,에스케이그룹 7개 계열사가 공동 운영하는 ‘CES 2024’ 전시관 ‘에스케이원더랜드’ 조감도. 에스케이그룹 제공,"[%%IMAGE1%%]<br><p class=""text"">에스케이(SK)그룹이 9일(현지시각) 미국 네바다주 라스베이거스에서 개막하는 ‘소비자가전전시회(CES·시이에스) 2024’에서 주요 계열사의 탄소 감축 기술을 망라한 공동 전시관 ‘에스케이원더랜드’를 선보인다.</p><p class=""text"">에스케이㈜·에스케이이노베이션·에스케이하이닉스·에스케이텔레콤·에스케이 이엔에스(E&amp;S)·에스케이에코플랜트·에스케이시 등 7개 계열사가 공동 운영하는 이 전시관은 클린 에너지로 달리는 기차와 하늘을 나는 양탄자 등을 타고 넷제로(탄소중립)를 달성한 가상의 세계를 체험할 수 있도록 꾸며졌다.</p><p class=""text"">앞서 에스케이그룹은 ‘CES 2022’에서 탄소감축 여정에 함께 하자는 의미에서 ‘동행’을, ‘CES 2023’에서는 탄소감축 로드맵을 실행에 옮기는 데 필요한 ‘행동’을 주제로 삼았다. 올해는 기후위기가 사라진 세상에서 느낄 인간의 ‘행복’을 주제로 정했다.</p><p class=""text"">에스케이그룹은 1850㎡(560평) 규모의 전시관에 탄소포집·저장·활용(CCUS), 폐플라스틱 재활용, 전기차 배터리, 도심항공교통(UAM) 등 주력 기술을 배치할 계획이다. 그룹 관계자는 “탄소감축 여정에 함께 하고 실행에 옮기는 과정에서 기업들이 어떤 기술적 기여를 할 수 있는지 보여줄 계획""이라고 말했다.</p><p class=""text"">시이에스를 주관하는 미국소비자기술협회(CTA)는 ‘시이에스에서 놓치지 말아야 할 것’ 중 하나로 에스케이원더랜드를 선정했다.</p><p class=""text"">홍대선 선임기자 <a href=""mailto:hongds@hani.co.kr"">hongds@hani.co.kr</a></p>",https://www.hani.co.kr/arti/economy/marketing/1123294.html,,,,,,,,,,,,,,,
